吞噬星空,我吃西红柿,科幻,2017-09-21 10:17,继《九鼎记》《盘龙》《星辰变》《寸芒》《星峰传说》后，番茄的第六本书！——————简介：星空中。“这颗星球，通体土黄色，没有任何生命存在，直径21000公里，咦，竟然蕴含‘星泪金’
悟空看私聊,李白不白,玄幻,2018-05-13 21:25,说起来你可能不信，郭大路的山寨手机被一道闪电劈中之后，微信好友里莫名其妙地多了一个名叫“孙悟空”的人。孙悟空性情乖张，一言不合就发红包，什么请仙问卜、什么参禅练功、什么朝真降圣、什
史上第一祖师爷,八月飞鹰,玄幻,2016-06-05 13:18,穿越了，也有了一个系统，但林锋压力山大。系统主线任务：林锋开山立派，建立史上第一大宗门，林锋本人成为第一祖师。于是为了成为史上第一祖师爷，林锋开始奋斗。“你叫石天昊？天生至尊，却被
八零后少林方丈,黑土冒青烟,玄幻,2013-02-19 22:49,老天不睁眼呐！居然把一个八零后风华正茂的大好青年穿到了古代，穿也就穿了，偏偏要穿成个和尚。穿成和尚也就罢了，偏偏还是个方丈！方丈也就罢了，还弄个方丈系统来约束咱！将童子功练到大成？
信仰诸天,朝不保夕,玄幻,2018-03-29 12:43,凡人世界，他是韩跑跑手中一具诡异的傀儡；我欲封天中，他是孟浩又敬又怕的师叔；仙逆世界，他是与王林把酒言欢的生死之交；盘龙世界，他是挽狂澜于既倒的光明教皇；遮天世界，他是狠人女帝不愿
万界淘宝商,叶恨水,都市,2018-05-07 09:05,苏宁开了个可以连通小说电影位面的淘宝店！可以在其他位面倒卖货物，更可以为其他位面的人解决烦恼！于是乎，苏宁牛逼了！接受托尼·斯塔克的求助帮他找回老相好美国队长。在仙剑位面收集五灵珠
钢铁皇朝,背着家的蜗牛,历史,2018-01-19 16:52,一场绝密级的试验爆炸让萧铭来到一个类似古代的平行世界。在这个满是恶意的地方，他身为最不受宠的皇子，拥有着一块最贫瘠的封地。不过幸运的是，绝密试验中一个名为科技晶石的物品跟随他一起来
相声大师,唐四方,都市,2018-03-14 09:46,男问：“这书好笑吗？”女摇头道：“不好笑，都冷死了。”男人解开自己的衣服，柔声道：“来穿上我的衣服，小心着凉。”女人也很感动，笑着说道：“谢谢，裤子就不必了。”……这是一部写现实的
超级教练,陈爱庭,体育,2013-01-31 20:23,一个2011年的球迷杨诚穿越到1995年德乙联赛开姆尼茨一名年轻足球教练身上，他利用自己比别人多出来的十几年足球知识，在所有人都觉得不可能的情况下，奇迹般的率领开姆尼茨保级成功，开
韩警官,卓牧闲,都市,2017-09-18 00:05,重活1996，记忆支离破碎，宛如庄周梦蝶。挤牙膏似的想起一点是一点，处处抢占先机。同样的起点，不一样的经历，且看韩博的警路人生。新书《朝阳警事》上传，恳请各位书友支持！书友群：45
唐朝好舅子,晨风天堂,历史,2018-03-08 20:51,大唐如诗篇、长安美如画。苦力级写手穿越大唐。盛世大唐多了一个乡野小民，一个让世界颤抖的小民。唐的文明与太阳一样照耀每一片阳光之下的土地。群号：274462109
超级融合,曾经拥有的方向感,仙侠,2011-09-24 12:00,灵气，是一切修炼者的根基。现代都市，灵气匮乏，灵丹妙药、天材地宝更是少的可怜。可许瑜意外获得从普通食物中提取灵气的能力，更能把灵气完美融合进任何事物……从此，属于他的时代到来了！且
娱乐星工场,给您添蘑菇啦,都市,2018-03-20 12:43,经营娱乐星工厂，升级录音棚，抽取混音师！雇佣五星编剧，培训四星艺人，努力把普通剧本拍成顶级大片！保持清新，拒绝妖艳！走心制作，欢快养成！书友群：423156138
龙珠之最强神话,枫叶缀,二次元,2018-03-05 10:43,夏亚，重生到龙珠世界成为了一名赛亚人，而这时距离贝吉塔星毁灭只剩下12年。“多多利亚先生，听说赛亚人的贝吉塔王正忙着造反呢，你觉得我该怎么处理？”弗利萨将酒杯递给旁边的侍从，饶有兴
楚汉争鼎,寂寞剑客,历史,2012-12-27 12:28,绰号“屠夫”的解放军老兵于一场边境冲突中牺牲，灵魂穿越到了楚汉相争的年代，并且成了项羽的堂弟项庄。此时，楚汉之争已经进入尾声，项羽已经穷途末路。垓下之战，十万楚军灰飞烟灭，项羽乌江
剑傲重生,蒙白,玄幻,2013-12-25 14:29,一代剑神风子岳以剑入道，突破先天境界。一剑西来，天下俯首，但他一生之中际遇悲惨，亲人离散，虽然无敌，却也有着无边的遗憾。偶然机会，他得到了一部能够一窥更高武学境界的秘笈《太玄感应篇
史上第一混搭,张小花,都市,2013-03-20 21:39,人家穿越，我还是只能被穿越人家泡妞，我还是只能被妞……在我的龙门客栈里，我接待了老槐树精、女鬼、神兽混血儿、冒牌茅山道士等人，发生了一连串让人忍俊不禁的故事本书恶搞气氛浓重，修真、
都市神话,马上将军,都市,2011-12-08 08:06,【本故事都是真人真事，绝对没有胡编乱造，真的！】——BY马上将军（眼神镇定ing）平生只修善缘，匆匆不是神仙。若要忙里偷闲，我有生命之泉如果有一天，你拥有了一个神奇的war3生命之
仙河风暴,快餐店,仙侠,2013-02-23 15:03,少年徐玄是修界底层卑微的炼体凡士。一次意外……他融合前世逆天强者的记忆，通过不懈努力，打开绚丽宏大的修行大门。体修，一个曾被视为“炮灰”的修行方式，当它真正的力量和古老底蕴，被发掘
超级仙医,五志,仙侠,2018-04-11 20:00,他，是雍城大学校医院的菜鸟校医，刚刚毕业踏入社会；他，是医术精湛、活人无数的仙医，中西医，无所不精；两个反差极大的身份出现在同一个人的身上，将会碰撞出怎样的火花？被老妈逼着相亲的女
中国猎人,步枪,军事,2018-03-19 14:30,【枪团荣誉出品】代号107！捍卫陆军老大哥的地位！隶属文化宣传队，但枪法一流，杀人放火样样精通，我们有另外一个名字——猎人突击队！从小兵到军中最年轻的将军，从特种部队横跨到空中突击
重生于康熙末年,雁九,历史,2012-06-27 14:31,一梦醒来，面对三百年前的江宁织造曹府。康熙渐老，大变将生；九龙张目，蓄势待起。不知几家繁华似锦，几家大厦将倾，江南曹家盛极而衰。为了亲人，为了自己，重生的曹颙认真地生活着……《大明
穿入聊斋,南朝陈,仙侠,2018-04-23 10:08,穿入到一个光怪陆离的聊斋世界，妖孽丛生，群魔乱舞，魑魅魍魉尽出。恰我心张狂，仗剑破红尘；正气浩然，下笔如有神！——庄生梦蝶，蓦然回首，人间道，妖魔道，我自行我道！%%%%%%%%%
星界游民,晨星LL,科幻,2018-02-28 23:23,星河时代，地球联邦与奥术帝国的战争，最终以两个世界的毁灭落下了帷幕。“星环时代”号舰长江枫乘坐的逃生舱，意外穿越了次元壁垒，跃迁到了一片陌生的星域，成为了地球联邦的唯一幸存者。原本
仙府之缘,百里玺,仙侠,2017-11-06 15:20,叶晨是武国一名平民少年，无意间得到一副《仙府》古画卷轴，从此踏上修仙之路。这座神奇的仙府内，有一头小青狐，一座木屋，一亩药圃，一座炼丹阁，一座炼器阁.....。沧海桑田，世间万变，
我在末世有套房,晨星LL,科幻,2018-02-28 23:25,核战之后的末世，到处都是一片狼藉。如果你一不小心活了下来，那么接下来你将不得不面对饥饿与疾病的恐惧，一到夜晚就会发狂的丧尸，还有那些因辐射而变得奇形怪状的异种...然而对江晨来说，
修神,风起闲云,仙侠,2016-05-10 13:20,有着建筑名师与盗墓者双重职业的楚逸，在祖传宝珠的引领下，来到了玄元星，一颗修真者掌控的星球。不甘平凡的他，从卑微的矿工做起，为的只是一线踏足修真路的机会……无上玄阳吾称尊，不修真仙
长生不死,观棋,仙侠,2012-06-11 21:49,凡人篇：为求长生，图谋天下！我钟山，要建立无上天朝，收集天下气运，冲刷己身业障，至此迎抗天威，开天辟地，长生不死。一命二运三风水四积阴德五功名！为了长生。修功名者，建立天朝收集天下
召唤圣剑,西贝猫,游戏,2015-01-23 16:34,这是一个混乱的年代，黑暗的阴影吞噬万物在烈火与死亡中挣扎，绝望与虚无笼罩大陆现实与幻想的界限变的模糊，当那一点星光闪耀在夜空中时能否改变这灭亡的命运，重新唤回那失落的的荣耀？罗德曾
大唐小郎中,沐轶,历史,2012-02-04 21:51,一个中医院的小药剂师，意外穿越来到开国之初的大唐，成了一家小药铺的小郎中。开药铺的父亲医术平平，老母慈爱而怯弱，姐姐泼辣护短。药铺濒临倒闭，一家人生活十分艰难。年边了，锅里只有混着
异界生活助理神,李仲道,玄幻,2018-04-05 09:53,身体、精神力、意识、心，在这样的一个“十字体系”上，方天漫漫前行。从魔法学徒，到法师，到大魔法师，到圣域，乃至于神域。前世的经历，渐渐化为今生的资粮，今生的努力，一点点走向那传说中
疯巫妖的实验日志,愤怒的松鼠,游戏,2017-01-02 17:50,这是个疯狂的巫妖，带着游戏系统，祸害整个世界的故事。“看下本日的日常……又是这坑爹的两选一，毁灭任意一座三万人以上的城镇，奖励10000点邪恶点数。抢三个小朋友的棒棒糖，奖励1点。
网游之射破苍穹,龙大人,游戏,2012-09-06 11:37,这是一个很‘射’的故事。这是一段传奇……
明朝伪君子,贼眉鼠眼,历史,2014-10-05 08:00,孝宗皇帝中兴大明，正德小子荒唐浪荡，士子激昂空谈江山，厂卫番尉如虎如狼。机会与危机并存的年代里，大明盛世的熙攘中，一个名叫秦堪的年轻人，吹皱了一池春水。当他以风度翩翩的优雅姿态为非
仙葫,流浪的蛤蟆,仙侠,2011-02-20 12:23,千般法术，无穷大道，我只问一句，可得长生么？
升邪,豆子惹的祸,仙侠,2015-04-14 01:04,九天之前，太阳落下后再没有升起。第十天，苏景名动四方。
环保大师,割鹿,都市,2018-05-10 05:26,林寒，一个年轻的护林员，偶然间获得了与地球意志沟通的能力。从此，他受雇于地球，作为地球意志的唯一代理人，为了全世界的环保大业而不懈奋斗。他可以提供最精确的天气预报、天灾预警；他可以
龙王的女婿,龙王的贤婿,都市,2012-01-24 19:50,不小心吞掉“薄荷糖”，就成为龙王的女婿……龙王是集团大BOSS，未婚妻是一颗小辣椒，众位长老……虎视眈眈……呃，这个世界真危险……
变身超毒舌少女,松子不吃糖,二次元,2018-03-27 10:31,1.人活着就为了……2.在这物欲横流，人心冷漠的世界，只有这又白又软的？？还有一点温度3.这个世界有中子、原子、质子，以及…………总结：文抄、搞事、装逼、日常、咸鱼、欢乐、毒舌、卖
庆余年,猫腻,历史,2009-04-29 21:49,积善之家，必有余庆，留余庆，留余庆，忽遇恩人；幸娘亲，幸娘亲，积得阴功。劝人生，济困扶穷……而谁可知，人生于世，上承余庆，终究却是要自己做出道路抉择，正是所谓岔枝发：东风携云雨，幼
带着系统穿时空,梦中捉刀人,仙侠,2018-02-22 22:06,公元1639年，崇祯十二年。这一年，张献忠在谷城再次反叛明廷。这一年，李自成从商洛山中率数千人马杀出。这一年，皇太极在关外磨刀，意图席卷中原。这一年，大明王朝在风雨飘摇当中，一步一
重生铸梦,银色纪念币,都市,2017-11-09 19:35,带着十几年的经历和先知，赵泽君一头扎回2001年。**************************新书已发欢迎围观《超神幼稚园》你以为幼稚园都是小盆友？那你就错了！见过36D的
巫界术士,文抄公,奇幻,2016-04-17 15:15,雷林带着智脑穿越，成为一名贵族身份的巫师学徒，通过利用自身优势，学习成为巫师，获得术士的传承，走上血脉的道路，在神秘诡异的巫师世界进行一系列探险，最后获得永恒的故事。有关更新：每天
蜀山旁门之祖,玉爪俊,仙侠,2013-09-02 17:47,钟元新生了，在一个可以修行成仙的世界里。而且，他很轻松就拜入了仙家门庭，可是，他还没来得及兴奋就发现，这个世界是蜀山。蜀山本也没什么，毕竟他很熟悉，悲催的是，他的师祖是红发老祖。红
我仍未知晓变身的原因,高山侃流水,二次元,2017-11-30 20:15,悲催大学生谢冠歆正准备和女朋友完成人生神圣的第一次时，意外变身成女身……于是，一段离奇而又搞笑的旅程开始了……
极品辅助系统,隐为者,玄幻,2017-12-15 00:15,当寻常武者还在苦苦修炼争取突破时，有了辅助系统的卫小天，已经杀怪虐人得经验，轻松升级到飞起！当普通丹师还在为如何炼制完美丹药而苦恼吗？有了辅助系统的卫小天，已经可以谈笑间施展天地烘
神魔供应商,何处不染尘,玄幻,2018-03-04 21:49,我种下一颗种子，收获无数的果实…回忆着歌词，江太玄看了看自己的药田，用力把嫦娥摁了进去。“来年，我要收获无数嫦娥！”专业种植，培养，租借，出售，回收一切神魔，一条龙服务。骚年，想成
重生之笑看风云起,落寞的蚂蚁,都市,2011-08-18 10:44,新书已上传，奸妄抽奖系统，不同以往的系统流小说，跟着蚂蚁一起嗨起来，欢迎大家收藏，推荐，留言！新书已上传，奸妄抽奖系统，不同以往的系统流小说，跟着蚂蚁一起嗨起来，欢迎大家收藏，推荐
文长的逆袭,静水流真,历史,2017-10-05 19:05,魏延，字文长。蜀国大将，诸葛亮去世后冤死。一个穿越回去想做孔明的人，意外的穿越到了孔明去世那年的魏延身上。是按照历史挂掉还是绝境求生，请关注本部小说。笔者谨以此作品，向不久前仙逝的
极品修真强少,鱼人二代,都市,2016-06-08 20:01,被赶出家族的修真纨绔成为未婚妻的贴身男佣！呆萌表妹，清纯校花，热辣女贼，美女侠客全都找我干啥？我再强，也应付不了你们啊，我还得修真呢！（鱼宝宝书友1群333702438）
生物炼金手记,真费事,都市,2018-05-10 13:30,新书《异度冲击》已经上传！——————鹿角、虎眼、马齿、牛耳、蛇身、鲤鱼鳞、虎掌、鹰爪、泥鳅尾于一体为龙；狮头、鹿角，虎眼、麋身、龙鳞，牛尾就于一体为麒麟；鸿前、鳞后、蛇颈、鱼尾、
网游之剧毒,黑乎乎的老妖,游戏,2016-11-10 15:52,这是一个意外地被捧为高手的胖子，为了保持所谓的高手形象，不得不开始装逼的故事…………………………继《网游之最强房东》后，本人的第二本书，欢迎收藏养肥。另：对本书主角不喜，请勿入，谢
晋汉奇侠传,锏川,武侠,2017-10-21 06:00,五代中后期，中原王朝战乱不断。北方的契丹逐年南侵，晋国江山大厦将倾。本书主人公就在这种环境下逐渐成长。他本为儒家弟子，为人谦虚、知礼，却被时代的浪潮推向武林，经过一番世事的周折，最
道法虚空,山春秀,仙侠,2017-11-30 10:55,本书小完结，莫慌莫慌，好多坑都会填的，当然，是在新书之中。本书只是穿越一下，现在流行穿越，你懂得。新书《带着神机闯诸界》已经开始上传，请各位多收藏多投票！
韩娱之天王,呓语痴人,都市,2014-06-19 20:42,新书已经上传，《韩娱之勋》，车位里也有推荐，希望大家能够多多支持~~另外，《天王》完结了，拜托大家投一下完本满意票，很重要！！谢谢。
宠物魔术师,大爱先生,都市,2014-06-21 14:54,一个普通的魔术业余爱好者得到了来自未来的生物制造器，于是命运即发生了翻天覆地的变化！“老板，想要养只宠物吗？”“有藏獒吗，我要纯种的？”“当然有，我这儿的藏獒都是纯种的，而且种类齐
妖弓,明月夜色,玄幻,2012-02-11 00:02,这是一个属于妖弓手的故事。一个另类的职业，一个另类的传奇……他没有高人一等的天赋，他没有震慑人心的霸王风范，他所拥有的只是一颗与众不同的妖丹。天才？我不是天才，因为我是天才终结者，
精灵之沙暴天王,红音也,二次元,2018-04-23 17:57,新书砂隐之最强技师已上传，求支持。“华蓝道馆，金黄道馆，红莲道馆长期不务正业绩效差评，年底考核不通过，剥夺道馆资格！”“丰缘地区天王来挑战我了？没空！我还要去月见山打击火箭队。”关
绝品天医,叶天南,都市,2015-09-17 22:23,高中毕业旅行途中，因为意外而被逮入特战小队做随队医生的江源，在全队全军覆没，剩下他一人无路可逃之后，带着小队抢到的神秘物品自爆了，但是他醒来之后，却发现自己带着一个怪异的纹身，奇迹
未来宠物店,维斯特帕列,科幻,2018-04-10 15:09,开了个宠物店，第一天却收到了只熊猫！这是什么鬼？救命，我不想坐牢啊！书友群：99343033
无限归来之超级警察,勿明,都市,2017-01-05 21:37,这是一个从无限世界归来的故事……这是一个退隐刺客改行当差佬的故事……这是一个传奇的故事……
拣宝,烛,都市,2013-12-09 21:43,别人打眼的时候，他在拣漏；别人拣漏的时候，他却在拣宝！商鼎周彝、和璧隋珠、战国错金玉带钩；秦俑汉陶、晋帖唐画、宋瓷缂丝漆器秀；竹木牙角、花梨紫檀，包罗万象在手中。一枚如意金钱，造就
巫师世界,滚开,玄幻,2013-09-21 13:36,穿越到异世界成为普通的小家族子弟，带着具有分析能力的生物芯片开始强大之旅.....书友qq群：209242950(已满)（对不住，之前是少了个0.....）书友群2：2092424
修神外传,小段探花,仙侠,2017-11-01 00:21,"神图合，惊雷鸣，禁地动，仙府出！仙道茫茫路何方？神迹隐,隐为何？天道无情人有情，万般欲念阻长生！内念无忧经，外练天雷身，独闯三洲四海，勇战妖魔鬼怪！手拿五行如意通天棍，扫荡妖魔无可"
殖装,铅笔刀,科幻,2015-04-05 00:02,当机甲过时，新的单兵武装出现的时候，战争有了新的模式。传统的军团在绝对的个体力量面前变得苍白而无力。新的生存法则就出现了。X35行星，末世历275年。一个少年在废墟中走出了他的第一
一言通天,黑弦,仙侠,2018-04-01 15:45,有一天，铁树开花，春芽冬发。有一年，大河倒转，漫天白鸦。有一世，善恶不辨，一生绝险。有一人，凭此一言，笑傲天下。他说天有九重，地有八荒，我欲七界争雄，不求六道栖身，我曾夺人五谷，也
狂仙,陈风笑,仙侠,2018-01-21 13:24,职场版：一个刚进公司的新人，如何在老员工的打压下生存和发展。励志版：一个离乡的小农民工，如何靠着双手适应并融入城市生活。电商版：一个刚出道的小掌柜，如何在林立的店铺中打下一片天地。
炼金狂潮,蓝领笑笑生,玄幻,2012-02-19 08:00,上一辈子我普通惯了，这一辈子投胎，我要找一个最有权有势有钱的人家！我要成为一个败家子！一个有权力有势力有金钱的败家子，嗯，最好还要有点狗腿子！！我要挥霍，我要败家！！【我要让世界面
东京道士,明月子时,仙侠,2017-08-20 15:32,天上白玉京，十二楼五城。仙人抚我顶，结发受长生。吕洞宾弟子重生，成为日本东京都一名十六岁的普通高中生。为求长生，隐身于芸芸众生之中，再度体验人间百态、滚滚红尘。数百年稳固的道心，究
大宋好屠夫,祝家大郎,历史,2018-02-01 10:15,《诗与刀》，已签约上传，必不失望。郑智穿越到了北宋水浒世界，变成了那个被鲁提辖三拳打死的镇关西、郑屠户。北宋末年，战乱四起，群雄逐鹿，华夏式微。正是英雄用武之地。水浒情仇，善恶忠奸
我的时空穿梭手机,金色茉莉花,科幻,2018-03-14 17:28,当安阳发现自己买的手机被调包了之后，他一开始是拒绝的，当他发现这部手机可以带他穿越无尽的时空，电影、电视剧、小说、游戏……他再也无法拒绝了！人生自此开始转变。时空穿梭普通群（一）号
玄天邪尊,乌山云雨,玄幻,2012-04-22 08:11,九天神雷淬体，天地法则在身，阴阳涅盘称霸，玄天真经独尊！神秘的石头，诡异的丹田，强悍无比的神功，让重生异世的他，获得常人难以企及的修炼天赋，一路高歌猛进！且看他，如何踏上武道巅峰，
仗剑高歌,踏雪真人,仙侠,2012-01-17 01:17,挥剑决浮云，高歌啸星河。修者如蚁的时代，仗剑高歌。已完本两本书，《无限杀路》、《网游之神经过敏》，人品有保证，请大家放心阅读，绝不会中途入宫。QQ群2879381513342252
少女契约之书,放开那只女王,科幻,2013-04-04 19:51,与二次元的美少女们签订契约，然后一起征服世界！傲娇强气的超电磁炮御坂美琴！天才魔术师红色恶魔远坂凛！吸血鬼真祖暗之福音依文洁琳！最终血统之七煌宝树蕾芙莉！蓝焰梵尽恶世的重炮者黑岩射
废土,黑天魔神,科幻,2012-05-24 00:10,对于病毒，你可以畏惧、退缩，结果只能是被感染后变成怪物。如果把生死抛之脑后，你会发现，病毒同样也能屈服于你的意志。它会让你变得更强，让你能够吞噬一切，控制一切，掌握一切，让你成为真
剑道真解,滚开,都市,2012-07-14 17:00,一个因为妹妹异能者身份，而导致牵连被杀的普通青年，重生到平行空间的自己身上开始的新的人生。一个真正的反派boss成长之路。前世平凡而无力反抗，今世却是等待重现那一刻的扭转。另剑道真
贼警,虾写,都市,2018-02-14 22:56,面对团伙化，境外化，高智商化犯罪袭击和报复，重案七组几近解散。左罗临危受命成为七组组长，以水逆计划招募苏诚，精诚合作，取长补短，重建七组辉煌。但作为不法之徒的苏诚会真心帮助左罗吗？
网游之重生法神,木牛流猫,游戏,2011-10-16 18:48,在我最绝望的那一刻，命运给了我一份赠礼。对命运而言，这或许只是一个无关重要的小玩笑，却让我有了改变一生的希望。曾经失去的，我会重新取回！给我灾难的，我会百倍奉还！当一切卷土重来，我
锻仙,新兵扛老枪,仙侠,2016-03-08 17:49,魂失异界，本应灰飞烟灭之人，却为一颗奇异之心所引，附灵身踏上修道业途。斩峰峦，劈叠障，翩翩少年欲成仙。他该如何求解证道，走出一条独一无二的补天之路！（我的新书《魔傀》将与五月一号正
大唐盗帅,盗帅二代,历史,2012-05-15 00:24,盗帅楚留香的隔代弟子杜长天无意间触动了中华瑰宝“传国玉玺”的神秘力量，致使穿越到了大唐王朝，来到了贞观年间，且成为了名相杜如晦的儿子。在这史上最繁华的时代，杜长天凭借后世知识创办新
不朽丹神,胜己,仙侠,2013-04-04 18:03,九州十大丹道大师最巅峰存在，炼化九州第一神器虚空阴阳鼎意外被十三道虚空阴阳劫干掉，却也因为这九州第一神器真正秘密而重生，但是没想到的是，竟然重生在了一个号称云歌城四大害之首，云歌城
系统供应商,凿砚,玄幻,2018-01-15 11:15,被废材逆袭，你是否屈辱？成为天才的垫脚石，你是否悲愤？身为出场两集就挂的炮灰，你是否不甘？不用担心，一切有我！身为诸天万界唯一的系统供应商，我可以为你量身定制各种随身系统，让你从此
黑卡,萧瑟良,都市,2018-04-02 10:10,一张神秘的黑卡，每周都会发放不同的额度，石磊必须在一周时间内将所有额度消费完毕，否则，将迎接黑卡的惩罚。“花钱真的是个体力活……”——石磊如是说。“先定一个小目标，比方说先花掉它一
北宋小厨师,南希北庆,历史,2015-08-17 15:37,身为一家超五星级酒店首席大厨的李奇，因为喝了点小酒，竟然奇迹般的穿越到了北宋末年。来到这个无亲无故的陌生世界，无奈之下，李奇只好抄起了老本行，在汴京一家即将贱卖的酒楼做起了厨师。李
神医圣手,小小羽,都市,2013-07-26 21:07,他是名医，也是神医。就算是死神盯着的人，有他在，死神也要乖乖绕道而行。只要你相信他，你的任何疾病都不在是问题。这就是张阳，一个被称为上帝使者的人，一个有点张扬，但很可爱的人！
