吞噬星空,我吃西红柿,科幻,2017-09-21 10:17,继《九鼎记》《盘龙》《星辰变》《寸芒》《星峰传说》后，番茄的第六本书！——————简介：星空中。“这颗星球，通体土黄色，没有任何生命存在，直径21000公里，咦，竟然蕴含‘星泪金’
召唤万岁,霞飞双颊,玄幻,2014-09-04 15:51,龙腾大陆是个纯召唤的世界，无魔法无斗气。宅男岳阳来到之后，惊讶地发现，自己变换了另一个身份，岳家三少爷，一个被美人退婚后投河自杀的淹死鬼。原来的岳家三少爷是个杯具男，是四大家族中公
大魔头,傲无常,仙侠,2013-04-22 00:03,玩召唤，炼阴魂，血祭万鬼幡。且看雷动从一个无名小辈，加入邪宗后，一步一步从一个普通少年成长为惊天大魔头，纵横于天下。顺我者昌，逆我者亡。
间客,猫腻,玄幻,2011-09-05 16:20,世界上有两件东西能够深深地震撼人们的心灵，一件是我们心中崇高的道德准则，另一件是我们头顶上灿烂的星空——康德当许乐从这行字上收回目光，第一次真正看到尘埃后方那繁若芝麻的群星时，并没
捡宝王,全金属弹壳,都市,2018-01-01 11:24,爱黄金，爱白银，更爱星光璀璨的宝石。枪械，珠宝，还有贵金属，收藏家的世界怎么能少了古董？仓库拍卖，旧货交易，房产收售，还有淘金挖矿，其实要想赚钱那么寻找传说中的宝藏才是王道。麾下坐
昏君,傲无常,历史,2013-04-22 00:05,生活压力很大？那就来当昏君吧！找工作被白眼？那就来当昏君吧！老板剥削厉害？那就来当昏君吧！房价高买不起？那就来当昏君吧！谈女朋友没钱？那就来当昏君吧！股票一路大跌？那就来当昏君吧！
武极巅峰,雨辰宇,玄幻,2016-05-04 20:06,罗逸，本是个待业在家的宅男，他最大的兴趣，便就是没日没夜的看着网上的各种玄幻小说，对那些光怪陆离的世界，神往不已。一个意外，他穿越了…这是一个玄幻的世界，妖兽与人类相互激战了无数个
三国之蜀汉我做主,三七开,历史,2012-05-01 21:10,这是一本刘封踢开刘备，单干蜀汉，逆袭成就霸业的故事。………………….三七新书，三国之窃国之贼已经上传，求关注！
史上第一掌门,冥域天使,仙侠,2012-02-21 18:06,穿越了，而且成了一派之尊！看起来似乎不错，只是这个门派似乎弱了点，人也少了点……“师兄，师傅说了，振兴本派的重任就交给你了！”唯一的同门师妹一脸不爽的说道：“如果你做不到的话就赶紧
异世为僧,萧舒,玄幻,2013-07-04 22:10,萧舒继《金庸世界里的道士》后之新作。转世降临，出家为僧，真能离情绝欲，慧剑斩情丝？修炼武功，有天下第一之志，可世间天才如夜空繁星，他真可达成？金刚不坏，身陷红尘，落入花丛，真能不垢
雄霸蛮荒,淡定从容的某人,玄幻,2016-07-08 20:00,天才们在修炼着古人开创出来的功法时，章叶却已修炼着自己开创的功法。别人为一本武道秘籍争得头破血流的时候，章叶却在出售自创的武道秘籍赚钱。天才们在为自己的一点成绩沾沾自喜时，章叶却已
唯我独尊,小刀锋利,玄幻,2011-12-20 11:34,天元大陆，强者如林，绝世隐匿！前世的秦立是个现代社会的武学高手，末武时代，法制完善，处处受限，更奈何基础不牢，止步于武极巅峰！尔后，他穿越了。。。穿越众最大的幸事，不是身份家世，不
蝶与谍,我是曹宁,军事,2018-02-16 00:46,戴笠：“你要多弄点情报给我。”周林：“这是日军进攻长沙的军事计划，换一百万大洋！”李克农：“有叛徒告密，日本人知道我们共产党有个蝶在他们身边。”周林：“小风浪翻不了船。这次有一百万
最佳导演,机器人瓦力,都市,2017-11-02 19:35,做一个导演，制作出让全世界为之疯狂的电影。这是王扬的梦想，可是他的人生刚刚受到了重大打击，因为被人诬陷而遭到南加大开除。但是上帝对王扬关闭一扇窗的同时，又为他打开了另一扇窗。在马路
百炼成仙,幻雨,仙侠,2017-12-11 15:38,仙路崎岖，百般磨练终成正果一个没有灵根的少年，一个被认为是废物的家伙，在修真界不断地收购着各种废品……无论是废丹还是下品材料，来者不拒，有多少要多少！
重生之神级败家子,辰机唐红豆,都市,2016-07-24 10:58,“我必须得败家啊，不败家不浪费我爸妈赚钱的才华了吗？”面对记者的采访，洪大力如是说。采访刚一结束，洪大力便拉出“大败家系统”界面，看着上面各种各样的好东西，摸着下巴喃喃自语：“再败
唐门高手在异世,莫默,玄幻,2012-10-18 13:59,宁遇阎罗王，莫惹唐门郎！行走在黑暗之中，卑鄙却不失本性，无耻却不丢风度的勾魂使者！一个唐门弟子重生到一个全是女子组成的门派之后的故事。老天顺我老天昌，老天逆我叫他亡！…………………
帝尊,宅猪,仙侠,2015-03-13 20:07,武道可以通神！武道修炼到神轮的境界，便可以炼就神通，超凡脱俗！
天下枭雄,高月,历史,2013-04-24 08:33,这是一个英雄辈出的时代，李世民、窦建德、王世充、李密、萧铣、张须陀、李靖、苏定方．．．．．大浪淘尽，千古风流人物。这又是一个充满机遇的时代，隋末天下，群雄争霸，美人似玉，江山如画，
独裁之剑,发飙的蜗牛,游戏,2013-01-29 22:13,来自银耀天堂的智慧之光，自然之力的守护者，这是阿克蒙斯神位德鲁伊的王者传奇。~~~~~蜗牛继《重生之贼行天下》之后，又一力作，大家可放心观阅。蜗牛已经完本网游小说：《重生之贼行天下
天骄无双,跳舞,玄幻,2015-04-08 14:13,神奇的大门即将开启！新的世界就在眼前！魔法，秘宝，海战，炼金术……生存的丛林之中，全能才是王道！一场事先张扬的穿越事件！一场化蝶重生的涅槃蜕变！热血疆域！与你！不战！不休！“永远都
冒牌大英雄,七十二编,科幻,2011-10-22 21:49,一个机械修理兵能做什么，研究、改装、奇思妙想？一个机甲战士能做什么，机甲战斗、精妙操作、奇拳怪招？一个特种侦察兵能做什么，深入敌后、徒手技击、一招制敌、伪装、潜行、狙击？一个军事参
巫师之旅,一行白鹭上青天,奇幻,2017-11-22 17:44,给我无尽的知识，我便以自身为支点，撬动无尽世界。故事讲述的是一个名为格林的巫师，依靠自己的智慧和运气，学习自己独特的巫师知识，游历异域世界，参与不同文明之间战争的故事。一直想写一本
从零开始,雷云风暴,游戏,2016-03-02 18:00,想要让游戏币兑换现实货币，那就一定要有一个强大的经济实体来担保其可兑换性。而这个实体只能是一国的政府。可是政府为什么要出面担保一个游戏的真实货币兑换能力？战争也可以这样打。兵不血刃
独步天下,宅猪,仙侠,2012-11-01 10:13,元神与生俱来，任何人只要在三十岁之前修炼到武道先天的境界，元神足够强大，便可以沟通诸天，获得天道认可，得到天道的传承。天道会赐下一座玉楼或者宝塔，塔中有相应的修炼心法和巫法！做到这
脑洞大爆炸,魔性沧月,都市,2018-04-12 02:02,幻想即现实，意淫即真理。当虚假的设定被现实所承认后，无论它有多离谱，那也是真理。‘百分百一箭三雕’，‘强行防御反击’，‘绝对无敌口令’，‘瞪谁谁怀孕被动’……一道超级伽马射线暴开启
网游之全球在线,笙箫剑客,游戏,2018-04-16 16:38,史上第一款集个人冒险+领地建设+位面战争于一体的跨时代网游《地球Online》，全球玩家在线，群雄争霸。且看重生后的主角如何建设领地，招募历史猛将名士，搅动风云，成就帝王霸业！（P
锦衣当国,特别白,历史,2012-01-12 13:42,现代职场人王通，在病死后来到明万历初年，这是大明最好的时代，也是大明最后的辉煌，作为锦衣卫子弟的王通，能做些什么，能改变些什么呢？在他出现的这一刻，时间长河已经变了流向......
至尊战神,君落花,玄幻,2018-03-26 23:11,【完本】神武大陆，强者为尊，武者天生一种武魂。五行相生相克，冰火不相容！金鳞即是池中物，冰火际会便化龙！一颗太古冰晶现世，一个烈焰圣体的天才，成就一个万界颤抖的传说！地球青年李凌天
掠天记,黑山老鬼,仙侠,2017-12-01 13:03,有人说他是修行界里的一粒老鼠屎，坏了礼义廉耻，乱了道门秩序！有人说他是南瞻部州最大的败类，勾结魔道，坑蒙拐骗，无恶不作！也有人说他是最危险的采花盗，请看好自家女徒，一遇方行误终身！
德猎,小伈,都市,2018-05-01 00:01,知乎：拥有德鲁伊和猎人的能力，是一种什么感觉？回答：真的可以为所欲为。————这是一个倒霉孩子，无意中拥有德鲁伊和猎人异能后，欢乐逗比的爆笑故事。
修真界败类,跃千愁,仙侠,2012-03-25 11:00,臭名昭着的死刑犯，死后来到一个陌生的世界。这里没有四个轮子的奔驰，有四个蹄子的宝马。天上没有飞机，有在天上飞的仙人。没有手机电话也没关系，有千里传音……这个世界太疯狂，前世只有书里
娱乐大顽家,五陵,都市,2018-04-26 22:18,星探韩歌手机上多了一款软件，能看到别人的天赋，演员、歌手、主播、球星……世界上的每个人都是独一无二的，有人擅长唱歌，有人擅长演戏，有人擅长踢球，还有人擅长……韩歌不禁感慨一声：“国
NBA万界商城,远古莱德,体育,2018-02-28 00:57,与万千平行位面NBA球星进行交易！艾弗森：“小子，我这穿花蝴蝶步，八折给你！”奥拉朱旺：“小伙子，我看你骨骼清奇，这梦幻舞步就交给你了！”里克-巴里：“额，我这端尿盆……你要不要…
九炼归仙,博耀,仙侠,2018-01-31 09:01,推荐博耀新书《大夏纪》。五行轮灵，真火九转；九九归一，九炼归仙。双脚踏翻尘世浪，一肩担尽古今愁；仰天大笑登九仞，我辈岂是蓬蒿人？男儿立于当世，理当顶天立地，负斩妖伏魔之任，登修仙路
大豪门,不信天上掉馅饼,仙侠,2015-09-30 09:31,一个忽然消失得无影无踪的修真领袖宗门，到底发生了什么？一位精通相术医道风水占卜的修真天才，要如何振兴这个已经彻底没落的宗门？这是一个曲折的故事。相信会很好看！馅饼完本老书《重生之衙
神级茶人,闲檀,都市,2018-03-31 17:15,陆雨进入的这个平行世界中茶人有巨大的影响力，但华夏的传统名茶和茶文化却神秘消失了！带着弘扬华夏名茶与茶文化，解开文化消失原因的使命，陆雨开启了成为全世界唯一的神级茶人之路！书友闲聊
神秘之旅,滚开,奇幻,2015-07-23 17:01,带着属性异能，穿越一个个世界。领略一个个异域风情的神秘世界。新书永恒剑主，有兴趣的可前往阅读。231786531为vip群，大家可进入讨论另外：（欢迎关注我的微信公众号，搜索——作
九项全能,十喜临门,都市,2014-06-28 22:34,《九项全能》因为种种原因，结尾有些匆匆。十喜颇为遗憾。但有失有得，第一次写小说，也是第一次写这么长的故事，让十喜对剧情的驾驭能力有了很大的提升。自信，下一本会更精彩。希望喜欢《九项
禁区之雄,林海听涛,体育,2013-01-20 10:01,他是世界足坛的争议性球员。他在球场上取得的成就有目共睹，但同时他冲动嚣张招人讨厌，他推搡主裁判，挑衅对手，引发斗殴……他让主裁判头疼，他让对手的后卫和门将头疼，他甚至让自己和对方的
天庭清洁工,李家老店,都市,2016-11-24 10:30,下界污染严重，灵脉破坏殆尽，导致几百年都没有人飞升成仙，而以前的神仙不是因为功德的积累而高升，就是因为年龄到了而退休，这直接导致天庭的底层工作人员紧缺，尤其是最低等的清洁工作更是没
黑暗文明,古羲,科幻,2012-12-30 17:14,当夜色落下帷幕，黑暗降临世间。一个后世称为“黑暗”的大时代来临，人类展开了又一次的新进化。带着末世生存十年的记忆，回到了末世发生的当天，叶晨唯一能够做到，就是保护好身边的人，然后…
纨绔疯子,鹅是老五,都市,2011-10-19 03:07,地球穿越到异界的多了，可是林云却从异界重生到地球了！这还不是最让林云郁闷的，最让林云抓狂的是他发现自己正躺在精神病院......－－－－－－－－－－－－－－－－－－－－－－－－－－
雅骚,贼道三痴,历史,2013-10-05 10:11,穿越到万历四十年，既想吃喝玩乐，又想直线救国。没错，就是这么一个充满情趣和矛盾的故事。晚明，江南，末世繁华；《菜根谭》的雅，《金瓶梅》的俗；老僧经商，名妓礼佛；袁宏道品茶插花抒性灵
纯阳真仙,EK巧克力,仙侠,2016-06-12 12:42,身怀无上法决，重生少年时代，踏入修道巅峰，成就纯阳真仙。前世的仇人，今生通通打倒；前世的遗憾，今生通通弥补。前世的极品天才、绝世妖孽……今生，通通都是浮云。ＱＱ群：【6573411
神魔养殖场,黑瞳王,科幻,2011-08-29 22:00,正在三流大学里混日子的苏羽，因为“天坑”事件，一座学校塌陷掉进“天坑”，出现在了一个恐怖的未知大森林中，在这大森林里，布满了各种恐怖~~~可怕的变异，从他的手，开始了……
歌星,京门菜刀,都市,2018-05-04 21:02,“爸，你想不想要那个长腿姐姐的电话？”“哪个长腿姐姐？”“就是喷泉旁边那个长得很漂漂的长腿姐姐，我给你要到她电话，你给我买个甜筒怎么样？”不待黄国仑答应，他的吃货儿子黄桃已经舔着舌
掌御星辰,猪三不,玄幻,2015-09-24 17:48,曾经抡过铁锤炼过器，挖过草药炼过丹，学过阵法制过符箓的天罡境高手重生了！重生到了那个令他不堪回首、遗憾重重的纨绔花季时代！等待他的仇人的，将会是一个接一个的噩梦！这一世，他要父亲望
重生潜入梦,第十个名字,都市,2018-03-28 15:25,我们的个性都是圆的，红旗下孕育着新的生命，在新时代成长的新一代。生于70年代的主角，再次踏上了一条他从未走过的人生路，假如这一天来临，假如时光能倒流，在这个变革的年代里，路实在是太
无尽剑装,衣冠胜雪,玄幻,2013-11-30 22:49,一个在家族中地位不高的玄气弟子，偶然在地摊上得到一块奇异玉石，里面藏著一门上古剑修传下来的绝世剑阵修炼之法！冰火两仪剑阵，三叠琴音剑阵，四合八级剑阵，六脉五行剑阵，七星八卦剑阵，九
我是大玩家,会说话的肘子,都市,2017-08-18 11:47,文抄公也不能不劳而获！你见过抄个小说就要被系统逼去玩命的穿越者吗？你见过说句前世名言就要被系统逼着体罚的穿越者吗？我特么就是想赚个钱而已，怎么就这么难！系统，你敢不敢不搞事情了？我
超级潇洒人生,胖达福,都市,2018-05-09 20:05,（都市架空，纯属虚构，请勿对号入座，纯属虚构，纯属虚构，纯属虚构，重要的事情说三遍）郭永仁穿越到了1979年的香港，从此开创了一段传奇。娱乐必须有，否则对不起这个时代。生意必须谈，
回到过去变成猫,陈词懒调,都市,2016-06-27 12:17,楚华大学东家属区大院门口，门卫大叔接了个电话之后，拉开窗子朝不远处的小树林中气十足一声吼：“黑炭，你妈叫你回家吃饭！”嗖——一只黑猫从小树林那边茂密的草丛里冲射而出，朝某栋楼跑去，
超级黄金手,小小羽,都市,2012-07-23 00:21,珠宝公司实习员李阳在平安夜的救下了一个小男孩，随后被意外的提拔转正。惊心刺激的赌石，典雅高贵的青花瓷，清纯可爱的大学生，英姿飒爽的女警，美丽高傲的下属，获得了特殊能力的李阳开始了完
大界果,蓝白阁,仙侠,2018-04-29 21:00,数万年前，一场大灾劫，彻底改变打乱了所有法则。在这个修行只能依靠各种灵植的世界之中，从贫困战乱村中走出的少年陈默，因机缘所致，入了仙途，更有了带着神秘种植空间的天铸之宝......
超级猛鬼分身,奥比椰,灵异,2015-07-02 20:07,发烧了几天，孟皈意外获得了一个超强悍的猛鬼分身！这下有乐子了。孟皈一向没什么节操……大半夜里不睡觉，到处去吓唬人，你到底要闹哪样？……新书《颤栗世界》已发布，书号：3584300，
一世富贵,安化军,历史,2018-03-04 23:49,穿越到北宋仁宗年间，金榜题名，却因为得罪太后，被打发到岭南为官。从边疆小官做起，步步升迁，徐平终于熬到出头天，在宋代书写自己的传奇。从五代乱世走来的北宋，世家大族一扫而空，社会上还
修真老师生活录,断桥残雪,都市,2013-05-02 19:42,他是一位年轻的大学老师，他还是一位无意中得传上古五帝真经，修炼了大混沌五行心法的修真者。他隐居大学教书育人，他行事作风低调，但不经意间却锋芒夺目……
神煌,开荒,玄幻,2016-03-11 12:50,宗守一梦醒来，发现自己穿越到了万年之前，神皇即将出世之前的时代。何谓神皇？宇内六合八荒无敌，十方百万世界之主！身为半妖的宗守，就这样以弱质之身，开始在这个群雄辈出，血腥无情的时代挣
猎国,跳舞,玄幻,2013-03-21 21:33,“不想谋朝篡位的权臣不是一个合格的权臣……总有一天，帝国的金币上会印上老子的头像！”——夏亚雷鸣【跳舞新书，欢迎新老朋友前来捧场～】
灭运图录,爱潜水的乌贼,仙侠,2018-04-03 20:54,修真，去假存真，照见本性。能达到这点的，则被称为“真人”，他们成就元神，超脱生死。灭运图录，灭运道种？一个偶得上古仙法的穿越客在这诸天万界、亿兆大千世界的修炼故事。群号：一群:二一
重生之恶魔猎人,颓废龙,游戏,2015-01-03 12:20,不属于光明的我们，不属于黑暗的我们，行走于边缘。没有礼赞的荣耀，没有圣歌的传诵，只有内心的骄傲。——《猎魔人守则.序》
华山仙门,秣陵别雪,仙侠,2012-09-09 23:00,这是一个简单的讲剑，和剑法的故事手执三尺青锋，习百门剑法，悟剑中真谛。陆元，乃是华山仙门北峰当中的一个普通弟子，本来以为可以悠悠闲闲安安然然的渡过一辈子，但是师傅寿元无多，各种各样
龙骑战机,华表,科幻,2013-12-03 12:10,中国最好看、最热血、最精彩、最激情的现代空战小说，空战流的至强篇章，仅此一家，别无分号!来自异界的龙骑士长剑直指被战斗机主宰的苍穹，化身为构装空中战斗兵器的巨龙振翅翱翔，两个世界的
君临,开荒,仙侠,2016-03-11 12:50,此刀当碎虚空界，此剑当开造化权！血戮尘寰世无双，傲视三界笑红尘！
一品江山,三戒大师,历史,2013-05-16 22:30,庆历五年春，范文正新政改革失败，富弼也跟着被下放，滕子京重修了岳阳楼，欧阳修喝得烂醉如泥，韩相公却依然高帅富，文彦博彻底成精；狄青成了大宋吊丝偶像，拗相公和司马牛才刚刚参加工作，包
守望黎明号,黑袍雷斯林,科幻,2017-11-28 12:57,主角陆远，大陆的陆，远方的远。这是他依托主神的世界，穿越各个不同的次元，最终拯救濒临毁灭的移民飞船“黎明号”的故事。奇幻瑰丽的博德之门，战舰争霸的加勒比海，超日常的幻想乡，超展开的
美梦时代,俊秀才,都市,2016-09-19 09:40,为了救一个小女孩，刚刚毕业的萧奇博士，从美国穿越回了八年前的中国，回到了自己的高中时代。作为一个重生者，萧奇究竟该怎样去投入这个波澜壮阔的变化潮流之中，从而站在金字塔的顶尖呢？白手
暗夜游侠,深蓝椰子汁,游戏,2016-06-30 00:26,新书《星河帝国》火热连载中！新读者欢迎移步试读！……传奇玩家马文穿越到大灾变的前夕。这是第四纪末，诸神联手摧毁了宇宙魔池，第四块命运石板开始在凡间酝酿。诸神、恶魔、传奇、魔鬼、巫妖
娇妻如云,上山打老虎额,历史,2012-04-22 08:56,史上最具艺术天赋的大盗，穿越到了北宋徽宗四年。身为祈国公府仆役，沈傲很欢乐，知识改变命运，智商决定前途，什么都是浮云，看我只手遮天。玩的是艺术，讲的是品味。伪作最好的名画，写最漂亮
唐朝好地主,木子蓝色,历史,2017-12-15 20:28,张超穿越武德四年，来到长安郊外灞上，成为了老府兵之子，但他却只想做个悠闲的大唐好地主！读者群：656118488（荣获2016星创奖历史优秀奖作品！）
仙鸿路,快餐店,仙侠,2012-01-22 08:08,修仙天才，一夜散功，逆天重修，走上传奇修仙之路。杨凡本是修仙家族的天才，偶然得到了一枚神秘“仙鸿戒”，可以连通神奇的仙鸿空间，批量栽培天材地宝和灵花异草。他一夜散功，成为废人，饱受
铁血德意志,流泪的鱼wyj,军事,2018-03-31 20:00,强权即真理！铁血首相俾斯麦曾说：“当代的重大问题要得到解决，不能凭演说和议会的决议……要凭铁和血。”军事发烧友秦天，重生成了威廉二世的第五子，即奥斯卡王子。原本只想混吃等死的他，阴
马踏天下,枪手1号,历史,2012-07-02 16:56,拿起了战刀，跨上了战马，纵横驰骋，马踏天下。
仙绝,石三,仙侠,2012-09-17 20:35,既然上天又给了自己一次机会，那就……修最强的功法！用最好的神符！抢最大的宝藏！会最美的佳人！把一切正道天才都踩在脚下，否则怎么能体现出自己上一世魔道巨擘的风采？至于魔道天才？上一世
主神崛起,文抄公,游戏,2017-07-07 15:17,一觉醒来穿越成反派？这剧本不对！还抢了人家的妹子？又有一个强势的姐姐？剧本更不对了！居然还有主神空间，诸天万界？我一定是在做梦！吴明淡定地木着脸，继续着征程。
黄龙真人异界游,神见,玄幻,2012-05-05 23:10,阐教十二金仙之一的黄龙真人在封神之战后，莫名地穿越到了异界，于是，在阐教混得不行的黄龙真人在异界开始了彪悍的人生。神兽很威？老子一个灵兽圈过去，给老子看门。十二翼天使牛逼哄哄？老子
通天大圣,蛇吞鲸,仙侠,2012-08-03 12:10,铁拳无敌，双锤横天！穿越之后的小豹子，只拿该拿的，只做该做的。绝不去担那太重的责任，也不会去应那不该尽的义务。所谓热血，早在前一世已经消磨干净。然而，当禁忌的血脉在他的体内苏醒，当
神奇铁匠铺,时间海藻,玄幻,2018-03-30 13:33,修真界，有一家神奇的铁匠铺，它的每件作品，都能引起全世界的追逐……修士们长年累月的等候在外，只求铁匠铺下次丢垃圾的时候能砸到他们头上……“哈哈，排队十年，他总算答应给我打造法宝啦！
无限之召唤笔记,李家成功,科幻,2011-12-28 23:24,新书在２０１２年新年后发表，敬请关注，多谢大家————————————————————————————召唤——李维可以召唤他想要召唤的一切——人作为一个电影、游戏、动画、漫画、小说
文艺时代,睡觉会变白,都市,2016-09-17 19:49,他曾在一个小县城中看到一个名叫小武的小偷，也曾在苏州河边见识过一条金发的美人鱼，更是在一个小村子里看过一个汉子在被砍头前学驴叫……本书很墨迹~——————————新书发布了《顾道长
神级剑魂系统,夜南听风,二次元,2018-04-10 14:49,森罗万象，皆为灰烬，流刃若火！穿越到海贼世界，大海贼时代十一年的罗亚，得到了一个能够无限强化，抽取各种技能的剑魂系统。流刃若火，镜花水月，月牙天冲，千本樱……“我这一刀下去，你可能
材料帝国,齐橙,都市,2016-01-11 10:52,材料，是工业的基础，也是一个工业大国的基石。秦海，一位来自于21世纪的材料学专家，穿越到了1985年的一家小农机厂。于是，一切遗憾终将不再，一切辉煌得以续写。电性功能材料、光学功能
明末工程师,米酿,历史,2017-11-27 11:22,二十一世纪的工业设计师李植穿越到明末。没有钱？搞个飞梭织布机来，立刻赚到盆满钵满。不习惯明末的差劲卫生？发明个肥皂牙膏来让明朝洗得焕然一新！农民起义？乱世人命贱如狗？水泥混凝土的棱
盘龙,我吃西红柿,奇幻,2017-09-21 10:22,大小的血睛鬃毛狮，力大无穷的紫睛金毛猿，毁天灭地的九头蛇皇，携带着毁灭雷电的恐怖雷龙……这里无奇不有，这是一个广博的魔幻世界。强者可以站在黑色巨龙的头顶遨游天际，恐怖的魔法可以焚烧
